<?xml encoding="UTF-8"?>

<!ELEMENT caramel-plist (setting)+>
<!ATTLIST caramel-plist
    xmlns CDATA #FIXED ''
    version CDATA #REQUIRED>

<!ELEMENT setting (#PCDATA)>
<!ATTLIST setting
    xmlns CDATA #FIXED ''
    blank (true|false) #REQUIRED
    key NMTOKEN #REQUIRED>
